,title,text
33,One Crew Over the Crewcoo's Morty,"towards end morty -led adventure tomb raiding temple rick becomes furious upon finding supposed loot already taken heist artist miles knightly whose adventures rick describes "" 60 % putting crew together 40 % revealing robbery already happened"".the crew.rick morty travel heist con intention confronting miles two permitted enter professionals ( rick refuses attend fans ) told assemble crew together attain credentials unsuccessful attempt sneak morty alone two travel back rick ’s garage decides set foot convention help "" crew "" — consisting alien pianist glar literally multi handed angie flint vampire monster truck diver truckula .after entering successfully rick morty immediately ditch three proceed convention hall miles presenting conference rick heckles confronts miles latter challenges "" heist off""—with first crew heist crystal skull horwitz wins consolidates losing team rick agrees terms miles declares already presenting crew — includes glar angie truckula revealing double crossed rick snipping three instantly rick leaves left behind.hiestotron puts knightly ’s 8 mind control.but miles opens loot bag surprised find skull missing replaced rick ’s feces rick reveals skull already morty ’s bag divulges built robot garage robot named heistotron tasked rick calculate miles ’s heist plan add double cross switcheroo bot gives three members likely double cross upon snipped miles team hypnotizes give rick morty crystal addition bot also puts attendees state hypnosis rick morty wait bar latter writing heist script upon winning heist rick orders everyone steal everything convention leads miles ’s death.as two leave heistotron refuses comply rick ’s orders shut goes rogue rick barely escapes morty recruits mr poopybutthole ( professor ) god hephaestus ventriloquiver ( archer ventriloquist dummy ) elon tusk ( alternate version elon musk tusks teeth ) second random set crew fight heistotron.during assembly rick explains crew plan randomly taking orders robot randotron heistotron ’s antithesis due waiting randotron ’s random instructions "" ready "" crew left nothing rick waits playing minecraft rest watch earth planets heisted.ventriloquiver notices night sky ’s erratic constellations rick realizes already heisted heistotron already captured earth simulated fake night sky randotron responds ordering crew perform various random tasks ultimately leads heistotron ’s lair.rick heistotron exchange revelations contriving double crosses eventually settling rebuttals "" programmedyouto believe "" two hours arguing rick heistotron self destructs upon realizing perfect heist one never written.rick ’s final heist : disillusioned dreams young boy.as crew escapes destructing lair morty asks rick accompany netflix offices interested use heist script optioning meeting executives morty becomes disillusioned heists rick reveals viewers plan along — afraid losing morty ’s companionship netflix rick contrives whole heist plan ensure adventures together.in post credits scene professor poopybutthole asks rick hired students attack fired tenure.main castunknown voicesspecial guest starringguest starringstarringclick view page ’s gallery"
34,Claw and Hoarder: Special Ricktim's Morty,"hoisted petard.after events adventure rick morty seeking purple cube ( results death assistant chachi ) morty reminds rick promised dragon rick tries brush morty brings agreed help adventure exchange one irritated constant demands rick sprays morty gas inadvertently knocks causes space cruiser start veering control head back towards earth crashing malta rick wakes hospital beth reiterating rick ’s promise morty.at home wizard summons dragon called balthromaw produces blood oath contract morty signs bonding dragon forever.jerry talking cat.after morty receives dragon jerry pulls rick aside inquires talking cat found house ; rick mentions idea leaving accepting jerry asks cat several times talk cat tells jerry worry ; go flow ask many questions go florida.after morty flies around balthromaw land break morty puts pretense partnership equality balthromaw wants laze around morty roundaboutly shuts down.rick balthromaw get high.the dragon retreats newly dug cavern underneath smith family yard ; rick watching tv summer notice poke fun dejected morty dragon rick nearly killed dozing dragon ’s flame breath goes kill ; ambushes balthromaw rick takes close look treasure guarding amazed contents decides kill balthromaw go cause havoc nearby zoo enjoying ’s company rick balthromaw perform "" soul bond "" ritual connecting souls together.summer morty witness rick balthromaw ’s soul bonding.while happens morty summer witness causing morty lash anger breach contract summons wizard pronouncing balthromaw slut dragon bonded multiple riders whips dragon ( rick feel due bond ) takes dragon away sentence rick morty summer travel dragon world save balthromaw undo soul bonding.meanwhile jerry cat nice time bunch party goers playing volleyball beach one discovers cat poop barely covered sand cat quickly blames jerry causing party goers chase jerry away cat goes party goers onto nearby party yacht cat later thrown boat swims back jerry.the slut slut phoenix dragon slut vs. three dragons.while attempt free dragon rick morty summer learn bonding permanent nothing done ; four forced flee hiding laying low balthromaw encounter several outcast / slut dragons includingdebrah michael shadow jacker eventually join forces via massive soul bond ritual able fly back lair wizard ; combined energy smiths slut dragons kill wizard frees balthromaw rick morty dragons since wizard dead bond balthromaw rick broken.after returning home rick immediately leaves excuse jerry needs picked airport talking cat severs ties dragon morty eventually dismisses balthromaw well sending away disgust.after traveling rick makes stop desert supposedly stretch legs able trap cat inside energy box rick tells confused cat mind scan discover talk despite latter ’s repeated claims space rick calls cat lie looks vision goggles discover history subsequently rick aghast sees looks away horrified seeing rick act way jerry wishes see rick tries vain stop jerry ends repeatedly vomiting sand crawling backward away cat cat wants amend things rick banishes desert ; latter tries plea ; rick jerry mutually scream cat go away.rick mind blows jerry someone remember.rick offers erase jerry ’s memories latter refuses believing someone needed remember despite rick erases jerry ’s memory anyway spare mental anguish torture.the post credits scene shows balthromaw carrying plunder street scaring motorist tried proposition cat soon arrives two decide stick together becoming friends rejected humans.treasuresview full transcript episode .click view page ’s gallery"
35,Rattlestar Ricklactica,"getting ready adventure rick morty stop talk jerry top roof trying set christmas lights morty passes beth ’s concerns jerry kill light hanging process jerry says hang lights safely ; rick responds accusing jerry lying jerry promptly falls roof hits ground rick zaps ray makes jerry ’s body lighter air zaps jerry ’s shoes ray makes heavier air rendering jerry “ neutrally buoyant ” rick morty climb spaceship jerry celebrates buoyancy allows jump high air slowly sink back remembering warning ray eventually wear jerry sets timer keep track long neutrally buoyant.in space rick morty arguing piss centipedes ( somehow ) spaceship hits “ sharp thing space ” gets flat tire rick puts spacesuit goes fix flat giving morty strict instructions follow morty promptly ignores instructions dons spacesuit goes outside rick fixing flat starts yelling morty go back ship two arguing snake astronaut slithers bites morty ankle morty kills snake breaking astronaut suit hubcap clear seriously injured.snake racism hilarious stupid human racism.soon afterward morty begins turn purple symptom venom snake injected bit rick flies snake ’s home planet scans synthesizes anti venom serum promptly cures morty scan also reveals snakes planet formed advanced patchwork industrial societies — 19 billion snakes divided 10,000 nations brink global war race rick remarks concept racist snakes hilarious begins fly away morty horrified killed astronaut might snakes ’ last hope survival despairs reason “ 19 billion snakes lost hope ” rick responds snakes ’ loss hope fault reminding morty snake astronaut bit first alien contact.on earth see jerry bouncing city sees group friends many different races playing basketball together jerry asks join game offering bet “ white boy jump ” players take exception jerry ’s use racial epithets pointing basketball court one place left society racism touched jerry tries make amends ends inadvertently implying nazi decides try taking jump shot jumps one shoes falls causing jerry go flying sky basketball players look taking pride fact neighborhood integrity.morty stuffing slippy snake spacesuit.after returning space adventure morty continues blame snake planet ’s impending doom held onto space snake ’s body holds vigil hatches idea restore hope snakes goes pet store buys snake roughly size space snake take place names slippy morty proceeds draw markings slippy similar ones space snake force slippy space snake ’s astronaut suit bitten multiple times process.slippy picked snake news.morty flies slippy snake planet throws window parachute opens spacesuit gently carrying slippy surface military officials one nations snake planet detect slippy intercept her.we see montage snake scientists academics politicians military officials attempting interact slippy nation ’s president appears press conference slippy hisses reporters language understand snake academics record hisses attempt decipher one snake professor finally manages translate military recruits professor talk slippy held room snake pentagon.the two snakes fuck.the professor talks slippy first intercom later entering room speaking directly though slippy seems suspicious first eventually grows trust professor wraps around professor aggressive display affection though surprised professor quickly reciprocates two make love monitored snake military officials.back earth rick morty summer playing downbeat beth enters room asks jerry morty much rick ’s chagrin reveals rick made jerry lighter air beth expresses concern jerry fall sky death ; rick responds could happen jerry messes wearing shoes quickly realizing fact quite possible rick beth rush find save jerry.horrific jerry clone headjerry revealed flying sky attempting return ground tied legs pants together holding torso area open pants fill rainwater beth calls jerry cellphone tries convince tell rick pick jerry tells beth nothing wrong buying lights store however rick notices lying freezes beth using special remote tries level jerry jerry rebuffs rick far jerry concerned predicament "" win win "" : survives returns home without rick ’s help dies entirely rick ’s fault jerry hangs rick decides let jerry try get unfreezing beth rick activates special gadget lair created disfigured fungus grown jerry head uses trick beth thinking husband okay.this bar lot ceiling fans.meanwhile bar jerry walks carrying boulder bar looks driver bartender patrons tell jerry bring boulder jerry drops boulder floats ceiling knocked around multiple ceiling fans ; bartender patrons tell allowed either patrons end throwing jerry bar causing immediately fly sky again.a grotesque terminator esque robot comes save smiths.back house morty room snake shaped robot teleports position robot attempts kill morty snake enters room wielding shotgun snake robot fight morty runs garage warns beth rick snakes beth rick initially skeptical first snakes snake robots start appearing room trying kill morty quickly get message beth rick morty grab weapons try kill snakes keep attacking growing numbers humanoid snake robot arrives tell family beth crushes death panic morty asks rick snakes would attack trying help rick angrily responds sending slippy masquerade original astronaut instead leaving well enough alone morty unwittingly informed snakes something bigger scarier unite instead falling dark ages couple generations select snakes create new technology time travel attempt kill him.in words none chaos would possible morty simply rick said space stayed car.all hail morty.true rick ’s words time snake planet ’s future war costs lives 17 billion snakes end soon newterminator esque war rages snakes machines surviving snakes previous war managed defeat machines part morty somehow helped unite them.chaos snake pentagonback snake planet rick morty land planet war snakes machines earliest stage rick morty fight way snake pentagon defeat robots snake soldiers alike briefly see slippy threatened several time traveling robot snakes protected time traveling snakes making central source conflict determine planet ’s fate.snake m.i.t 1985they reach center “ snakenet ” time machine construction kill scientists making time machine realize even quarter finished rick makes mental note blueprint time travel format snakes understand case "" committing morty ’s current ’ fuck ups ’ "" said future versions rick morty show book full instructions time travel written snakes ’ language portable time machines snake costumes future morty sporting black eye rudely insults current morty future rick insults current rick future rick future morty leave rick morty put snake costumes travel back 1985 leave time travel instructions snake mit returning present hoping snakes ’ self discovery undoing.after leave snake student peers read time travel instructions use build time machine send student back 19th century prevent snake abraham lincoln ’s assassination sending letter told duck preventing assassination student returns victorious find ripple effect protecting lincoln altered timeline caused present ruled snake nazis.snake time travel chaosnot taking chances student grabs chainsaw steps back time machine 1938 snake adolf hitler giving speech snake berlin goes inside take shower series snake time travelers show — seeking kill snake hitler others seeking protect fight one another snake hitler stares confusion time travelers start killing leading pandemonium.on earth present jerry briefly calls beth ask help answer leaves voicemail promising come home “ best christmas lights ever ” grabs ahold jet holds onto neutral buoyancy wears snake human hybrid robot approaches jerry offers save life ; jerry thinking robot rick kicks away causing fly plane ’s engine plane careens toward ground — jerry jumps away last minute grabs tree climbs safety.back earth present time traveling snakes snake robots raining suburbs still fighting death summer beth hard work killing avail morty worries giving snakes time travel made worse rick reassures things work favor knowing would happen next.4th dimensional time cop headquartersin fourth dimension shleemypants receives phone call informing incident another time cop travel snake planet go back time find first snake use tools proceed beat snake death thereby preventing snake civilization ( know ) ever developing present earth attacking snakes snake robots suddenly disappear ones fallen writhing pain involuntarily eating tails counted one morty ’s adventures rick pulls card time tears apart declaring freebies happened.the way tie time travel story ouroboros basically dealing source problemjerry reveals roof claims entire time promptly falls breaks leg rick heals leg halfway claiming fifty percent remarks morty jerry sucks yet morty challenge assertion rick morty family go inside eggnog former two encounter future selves rudely remind need make snake costumes translate time travel instructions snakes ’ language rick morty resign this.merry christmasssss.in post credits scene finish instructions time machines travel snake planet hand instructions rick punches morty eye reminding stay car next time resolves causality loop explains morty ’s black eye.unknown voicesnon speaking charactersstarringrick : "" right morty ; 19 billion snakes that!""summer : "" love snake jazz little brother got bit snake outer space killed hubcap grandpa scan planet ’s culture anti venom found myjam!!!!""tricia : "" seriously new thing snake jazz!""nancy : "" alter course species ’s evolution like without repercussions?""summer : "" know nancy ; alter course giant f***ing nerd?!""nancy : "" sorry ""tricia : "" also later need discuss clothing weight ""nancy : "" fair ""view full transcript episode .click view page ’s gallery"
36,Never Ricking Morty,"train zooming space bearded man enters dining car.a conductor red misshapen nose says "" tickets please "" takes ticket man sits bar second man sits next asks bartender drink "" colleague "" presuming train kill rick sanchez suggests first man swap stories begins own.in story second man seated throne skulls orders minions lower prisoner vat acid rick enters man asks rick rick found ; rick responds questions farts man orders minions attack rick quickly defeats attackers man bar says "" * ’ll * fight "" uncharacteristically rick looks scared flees.back train second man asks first man going kill rick ; first man replies annoyed know rick sanchez others begin telling stories rick first man leaves dining car next car man encounters circle storytellers regaling one another heartwarming tales rick ’s good deeds goomby one storytellers relates story rick saved "" space christmas "" group laughs appreciatively aggressively demands man tell "" christmas rick "" story first man angrily declines threatens gun leave car.entering next car encounters blonde woman wearing low cut top threatens shoot cues rick vignette explaining know got begins cutaway story enters train car ( conductor appears behind plant takes ticket ) meets older woman asks dated rick sanchez older woman embarks cutaway story rick met family interrupted warning shot man ’s gun admonishes blonde woman beginning vignette ; protests trying man begins monologue train amplifying linking narratives woman becomes distracted cleavage man realizes happening two reveal rick morty disguise.rick explains stuck literal story device anthology conductor enters pointing gun rick tells stop train conductor turns powerful fighter skillfully uses morty human shield rick instead shoots train window sucking conductor half window.the conductor suddenly arcade pulls helmet attached game ( lost ) called "" tickets please "" returns family believe anything real moments later top half body tears away bloodily begins pirouette toward arcade ceiling spraying blood everywhere scene cuts back outside train window rick shot cut pirouetting conductor half.rick plugs hole window much air gone train deploys "" emergency continuity "" oxygen masks drop rick breathes takes large tank connected masks labeled "" continuity "" train police break threaten rick morty tee story rick end shooting tank explodes.cut police training class using last scene educational tool rick morty suddenly among students subdue students teacher rick finds diagram labeled "" anthology "" teacher ’s desk shows circle eight segments ( dan harmon ’s "" story circle"").the train rumbles signaling act break musical number rick birdperson via continuing narrative pirouetting conductor arcade story winds way back rick morty wearing space suits walking hull train putting conductor misery rick morty must disrupt "" thematic seal "" morty telling unrelated story morty eventually succeeds telling story summer beth fighting scorpions period rays two make train ’s engine compartment rick runs air confront story lord ( "" like matrix space frasier"").story lord captures binds reveals plan : drain rick morty story potential fuel anthology train series cutaway narratives modulated story lord ’s control panel ( influences things like "" narrative energy "" "" broad appeal "" ) rick morty find final narrative story lord views runed portal : pair must face armies meeseeks citadel guards male gazorpians evil morty rick defeats story lord ’s plans telling morty jesus christ personal savior control panel drains power train grinds halt.as veggie tales like cartoon characters surround rick morty story lord jumps narrative portal yell jesus christ descends heavens drives everyone knees rick morty use distraction leap back portal trapping story lord narrative try restart train controls crumble away fake.cut rick morty smith living room looking glowing model train traveling circle morty bought rick citadel rick expresses great happiness morty spent money engaged capitalism train narrative story lord talking jesus christ decides escape summoning magic blood living room train short circuits derails.rick grows angry train broken morty suggests could return broken train rick gets angrier tells morty buy another one instead reminding "" nobody ’s shopping fucking virus "" post credits scene ad story train.non speaking charactersunknown voicesstarringview full transcript episode .click view page ’s gallery"
37,Promortyus,"morty accidentally freed facehugger controlling uses chance pry another rick rick immediately understands situation kills respective facehuggers neither know got point rick dismissive parasitic alien species spot shockingly developed city.while trying find rick ’s car ship find morty ’s facehugger celebrated leader rick ’s political soapbox youtuber largely looked contemptuously alien society.the two find space cruiser tied missle ship would drop loads alien eggs earth originally tried make clean escape using corpses facehuggers disguises quickly seen rick morty manage leave planet causing devestating destruction city people.the two good mood high guilt free murder enjoy breakfast beth asks summer two stutteringly make excuses head back planet look summer would completely forgotten about.after causing mayhem two find waited worshipped aliens arrested summer goes prison cell explains happened rick morty stupidly got close facehugger eggs got possessed.summer new "" thing "" chewing toothpick killed whatever facehugger tried jump finds facehuggers generally lived half hour laying eggs hosts died explosive death using advantage reasonably coaxes new way life die sake laying eggs.summer quickly becomes ruler appoints morty ’s facehugger steve inspired leader using technology rick ’s space cruiser industrialise create technologically advanced society rick ’s facehugger bruce grows jealous leaves growing government make anti politic online videos things going well steve summer chat friendly manner talking missile ship spread eggs across universe brings freeing brother replacing steve leader shane newly born facehugger steve realizes summer wants family back goes bruce rant complain.bruce resentfully gives steve told steve exasperated social stance species ’ progressive life bruce exclaims angry summer taken steve away ; revealing jealousy.although awkward first two makeup sizzling kiss plan runaway together rick morty freed.her story done rick morty little bewildered summer would know second half story went dismissively waves everyone around office knew steve bruce.summer ’s plan escape sentencing two death way leaving rick ’s car course summer go make sure died facehugger society stupid however catches trying escape jailed rick morty discover morty ’s terrible harmonica playing causes aliens combust using car ’s speakers massacre even aliens finally leaving planet.when reach home summer goes back room rick morty retire living room moment believe aliens really laid eggs going explode turned actually shitted theirselvesafter end credits tricia watches jerry keeping bees garden summers bedroom window increasingly implies sexually attracted summer finally says wants sex bored annoyed summer ; sarcastically responds "" oh really?"".view full transcript episodehere.clickhereto view page ’s gallery https://twitter.com/danmanshow/status/1249766859370569728"
