,title,text
50,Rickmurai Jack,"  rick fully immersed "" rick two crows "" show become anime protagonist fights anthropomorphic owls using crow themed gadgets crows side sidekicks defeating owls village morty approaches desperate get back together rick rebuffs awkwardly time later rick approached bar 40 year old morty claiming rick gone long jerry died stage 4 cancer summer gotten married junkie begs rick come home rebuffed again.that night crows sneak visit crowscare rick ’s arch nemesis plan adventures rick catches realizing crows using rebound used rick returns home find morty lying time passed took aging serum citadel ricks emotionally blackmail visit citadel get morty aged notices deformed morty raving citadel inescapable weapon mass destruction shot police shortly afterwards rick morty invited dinner president morty pardoned former crimes rick suspicious agrees visit.over dinner president morty hints rick built citadel requests information rick bring "" central finite curve "" rick refuses president morty binds two chairs revealing kept partially completed brain scan evil rick took "" close rick counters rick kind "" completed appetizers enough needs morty apologizes rick bringing citadel disgusted president morty uses brain scanning device show morty full extent citadel ’s morty abuse reveals morties demand citadel started forcibly making beths jerrys fall love produce morties resorted cloning morties shipped ricks across multiverse sidekicks morty dies new one brainwashed old copy ’s memories sent replace them.morty horrified loses faith rick frees bonds president morty allows leave rick suspicious realizing morty refilled portal gun ’s fluid visit shoves rick guard portal test finds internal coordinates locked blender dimension guard horrifically dismembered rick recognizes president morty evil morty knowing one ever hacked portal gun fights guards morty escape meanwhile evil morty loudspeakers citadel say "" nobody leave everybody stay "" repeatedly ricks morties naturally attempt leave killed instantly hacked portal guns send hostile dimensions.as citadel descends chaos rick morty descend bottom hoping find untainted portal fluid source drained rick explains evil morty needed brain scan obtain schematics citadel ’s dimensional drive could penetrate central finite curve promises explain escape morty unsatisifed refuses go rick caves gives morty brain scanning device shows backstory rick prime killed c-137 rick ’s diane beth motivated finish portal gun explore multiverse making life ’s mission hunt rick prime avenge family however matter hard tried rick could never find prime resulting killing dozens ricks across multiverse hopes catching time descended depression became alcoholic cope citadel created get away c-137 rick board c-137 rick came prime dimension deciding wait prime come home.the two meet evil morty drive states ricks use trauma justify anything tells morty citadel ricks created "" central finite curve "" barrier separates every universe rick smartest rest multiverse plan escape curve live life free rick explaining makes evil fed rick morty disappointed learn rick came back crows dumped evil morty states "" evil "" activates citadel ’s dimensional drive causing begin opening wormhole time portal fluid floods citadel meanwhile ricks morties attempt use operation phoenix escape rerouted citadel ’s cloning vats dumped meat grinder remains used power drive.as citadel begins collapse rick trapped debris evil morty offers let morty join forgives rick saves rick morty return surface evacuating deformed morties underground mortyburg rick detaches citadel portal fluid reaches attempt accelerate away fluid creates black hole rick morty able accelerate reach saving mortys inside stranded outer space portal fluid meanwhile evil morty leaves citadel escape pod explodes travelling wormhole penetrating curve emerging greater multiverse sighs relief confirming curve destroyed opens gold portal upgraded portal gun steps through.in post credits scene mr poopybutthole talks audience end "" evil morty "" arc collapse relationship wife rick caused lose job "" one crew crewcoo ’s morty "" hypothesizing becoming "" evil "" ( shown "" never ricking morty "" ) makes dinner tiny apartment urges audience give love back love"
51,Solaricks,"getting stranded remains citadel events previous episode rick morty rescued space beth brought home rick tries fix portal gun evil morty ’s sabotage resetting portal fluid accidentally causes glitch causes people used portals sent back original dimensions – includes jerry due events "" mortynight run "" gives summer instructions get back portal travelers zapped away : jerry dimension 5126 mix jerryboree morty prime dimension rick dimension c-137 .rick gathers materials needs old house conversing ai diane sanchez created "" haunt "" decides held death plan revenge long resolves move really settle smith family come care departing dimension wormhole created summer however ai suggests rick killed beth ( rick prime ) would also sent back original dimension rick ’s mistake portal fluid prime dimension morty encounters dad travels deaths beth summer adapted rick like nihilistic philosophy : rejects morty ’s attempts reconnect reminding abandoned dimension family twice rick arrives pick morty reveals prime dimension fact rick prime ’s home dimension rick originally settled hopes would one day catch returned break rick prime ’s lair finding either clone tube pre recordings rick prime mock rick goes offensive wanting revenge rick prime family morty convinces stand reminding family back different dimension worry about.space beth finds caught dispute beth summer summer trying bond space beth cool "" space mom "" pair beths argue raiding citadel fighting five dimensional monsters came wormhole though summer able convince back rick morty return save aliens retrieve jerry dimension 5126 turns dimension divorce jerry beth season 3 never happened smith family relationship pretty much season 2 making jerry appreciative brief period beth divorced leaving jerry scolds original family behavior proclaims interdimensional traveler.the family returns dimension c-131 encounter original jerry dimension brought back house taking shower upstairs waiting sort everything however accidentally unleashes cute deadly parasitic boogens named mr frundles takes world mere seconds forcing entire family plus space beth move toyet another replacement dimension coincidentally died exact moment "" natural "" causes – major difference residents dimension pronounce "" parmesan "" strangely new dimension beth space beth make peace morty asks rick used bait rick prime rick affirms rick prime simply care family remarking ways rick prime "" real deal"".in prime dimension jerry encounters none rick prime ( really lair ) inquires whereabouts rick morty jerry feigns interest alliance defeat two slashing rick prime ’s throat rick prime reveals regenerate quickly promptly shoots jerry expressing admiration jerry ’s unusual ruthlessness finishing wondering got back home prime dimension"
52,Rick: A Mort Well Lived,"rick morty summer trip blips chitz goes awry arcade overrun gang aliens morty playing roy : life well lived gang attacked becomes trapped game mind spread across various npcs forcing rick go game roy try get morty summer meantime instructed rick "" adie hard "" fight back aliens ( turns led certified expert ondie hard ) even though seen movie ultimately uses advantage taking aliens surprise following tropes used indie hard.inside game rick ( roy ) attempts explain npcs grandson stuck video game.the explanation develops new religion among multi morty population splinters different cults eventually leading religious wars order get morty game mind intact rick get mortys agree fly space beyond programmed edges game forcing reset eject minds back real bodies rick finds morty named marta full realization existence part morty ’s complete mind team take mission unite mortys.years pass within game manage get 92 % world ’s population agree leave remaining 8 % also long since realized video game refuse feel real rick actually contemptuous never said "" love "" morty decades game better living full life game marta morty asks rick tell loves morty agree leave rick ’s awkward hesitancy proves point decades pass time marta joins opposing side rejecting rick ’s attempts free eventually loses keep fighting morty npcs including father age die.even children decide join rick commands mortys leave game tells rick remain behind.the world ’s mortys board space ships fly space beyond game ’s borders.rick morty freed game injected real bodies time help summer manages one alien gang one last time reading plot summary ofdie hardand actually performing one tropes ( i.e. taping gun back ) three depart blitz chips revealed audience rick paid theroy : life well livedgame remain powered allow marta morty live rest life peace.in post credits scene gang aliens tries dodie hard 3 made difficult fact previous leader died playing hans gruber role blips chitz"
53,Bethic Twinstinct,following promise “ solaricks ” space beth comes back smith family house thanksgiving stay relationship beth develops bond bottle venusian wine eventually casual flirting develops full love affair summer morty notice first quickly become obsessed playing ultra realistic alien video game bid avoid thinking rick figures going tells beth understands ( done something similar years ) needs think affect family : morty summer quickly become concerned jerry previously claimed would kill beth left beth begins express doubts space beth admits affair front jerry promptly rolls pillbug ( protocol rick built would forgotten ) rick reveals jerry emerge pillbug choice trying force make things worse.while rick joins morty summer focusing realistic video games two beths soon find fundamental difference think jerry : space beth thinks pathetic would rather leave pillbug shell beth still loves tries encourage come eventually two beths decide wipe knowledge others ’ existence using rick ’s memory wiping machine despite rick pointing would leave rest family deal knowledge happened jerry overhearing leaves shell declares let lobotomize says still leaving beth eventually emerges jerry upset two beths hooked behind back fact actually quite enjoys cuckolded rick morty summer uncomfortably listen dining room table jerry two beths increasingly sexual conversation culminates three hooking rick forced calm morty summer finally break situation.space beth bids family goodbye promising keep eye space grandson rick quickly gets rid venusian wine apparently caused two beths fall other.during post credits scene jerry visits jerryboree apparent attempt pull love affair beth permitted receptionist due jerryboree issue past runs stray jerry streets similar desire two share quick kiss deciding curiosity satisfied quickly part ways
54,Night Family,"  beth trouble falling asleep due jerry ’s snoring tries sleep couch however startled rick crunches floor living room rick leaves room without saying thing breakfast rick explains beth saw "" night person "" rick purchased machine called "" somnambulator "" goobie joob system allows program unconscious body things sleeps time awake result washboard abs thanks night rick working much naturally rest family want piece action request night versions rick initially refuses eventually gives in.at first family quite pleased night selves chores boring routines training bodies waking family use beth learns play trumpet summer learns spanish morty joins rick squats gets impressive abs ( two starting podcast subject ) jerry becomes pen pals night jerry however one day jerry tells rick request night summer day family start rinsing dishes using easier wash rick enraged request telling rest family intention whole point night people shit day people want next morning smith family wakes find dishes broken night selves defiance rick responds calling favor devil like alien another planet make unbreakable plates.that evening night family retaliates led night summer strap rick force eat leftover residue plates making vomit also get rid house ’s furnishings hide somnambulator prevent rick destroying ( would destroy night family ) taking declaration war rick creates suit keep summer awake go undercover evening find somnambulator destroy unfortunately fails night summer takes control summer night rick cuts day rick technology builds robots enslave day family.after days working slaves family able escape help night jerry ( friendship day jerry ) try escape range somnambulator ; however time one knocked tranquilized robots night versions take leaving others try wake leads car chase member family knocked awakened several times adding chaos confusion situation eventually night summer offers day rick truce ; ’ll let day family go promise rinse dishes day rick still refuses night family takes complete control.months later going several expensive vacations living lives luxury night family completely destitute realizing day family ones properly handled finances deciding control worth anymore night family destroy somnambulator release smith family everyone wakes disoriented rick checks see going discovers terrible news choco taco discontinued everyone ’s devastation"
55,Final DeSmithation,"smith family dining panda express discuss next day ’s trip zoo jerry complains place giving diarrhea although others point would happened eaten food meant animals meals family given fortune cookies summer pointing comes true cookie eaten first although rest family given generic meaningless ones jerry ’s fortune reads""you sex mother"",much everyone ’s shock dismay.jerry starts getting paranoid fortune might come true despite fact obviously would never sex mother beth implores ignore morty summer find hilarious begin poke fun jerry ’s nerves get worse mother starts calling since trying ignore begs rick investigate use science make impossible rick refuses stating using science make something impossible usually ends making possible.jerry tries taping genitals morty summer continues play various pranks jerry ( including hiding stuffed doll made look like jerry ’s mom wardrobe falls repeatedly making look like performing fellatio ) jerry becomes paranoid even starts dressing like morty since morty ’s mom beth space beth arrives pick family zoo trip rick asks jerry stay behind getting strange readings jerry ’s probability field regarding fortune rest family leave rick admits made strange readings get jerry going zoo admits much dislikes jerry right take seriously turning device rick startled find jerry ’s fortune registering decides run test getting two boxes holes writing jerry ’s mom ’s name one asking choose one hole would stick penis rick repeats test several times sometimes switching boxes worried jerry keeps picking mom box rick decides something would never willingly choose go panda express reasons someone trying get attention ( mentioning restaurant get liquor licence).arriving jerry announcing presence backroom staff finds shootout easily able handle killing employees however finds panda express staff actually running meth ring ( obviously rick mind due aversion concept laws ) nothing fortune cookies get usual distributor apologizing two remaining staff murdering colleagues ( accept saying part risk ) rick agrees turn cops exchange truck delivers fortune cookies.taking truck factory fortunes made find coming building way extravagant company makes something given away free entering dodging retinal scans find hundreds similar trucks cameras everywhere rick changes clothes blend calling eye thundera makes jerry look like assistant transformation sequence lifted sailor moon.while infiltrating factory pair quickly realize company controlling fate profit jerry wants rick blow factory rick would rather take factory instead soon run two security guards use emergency fortune cookies beat rick fight choice rick jumps air vent escape using jerry human shield jerry survived taken inside vent well ceo factory jennith padrow chunt sees photos jerry detects unresolved fortune tells guards get jerry ’s mother factory.while crawling air vent jerry expresses annoyance rick using human shield rick explains since jerry unresolved fortune literally die fortune fulfilled ( case sex mother ) two eventually find way room fortune cookies produced center room huge alien strapped ceiling fed glowing capsules pooping fortune cookies old man puts fortunes inside cookies rick explains jerry alien lockerean species feeds chaos particular lockerean digestive issue makes strip randomness away space time leaving behind super dense pockets energy form fortune cookies bend entropy towards definable outcomes old man introduces old man hucksbee explains fortune 500 ’s plan : increase value real fortunes mass producing many worthless ones old man hucksbee also apparently romanced lockerean wants escape factory put weird fortunes ( including jerry ’s ) cookies hopes someone would investigate factory find break free moment jennith padrow chunt arrive jerry ’s mother well many armed security guards.jennith knowing jerry immortal sex mother pushes mrs smith toward trying get sex jerry runs away rick fights soldiers special powers due ingesting fighting fortunes uses fortunes jumping boxes fortune cookies ingest random ones hoping find something good first batch really notable effects due mass produced worthless fortunes rick finds box "" blanks "" cookies without fortunes make effects upon consumption completely unpredictable settles force feeding soldiers blank fortunes order combat randomness rick eventually realizes jennith immortal fortune comes true become successful businesswoman ever fulfils fortune hacking goldman sachs finance company stealing trillions dollars purchasing everything jennith ’s company offers emptying accounts sending money back goldman sachs enraged jennith swallows many fortune cookies becomes blob like monster rick frees lockerean swallows jennith old man hucksbee.unfortunately chaos still yet running away mother jerry trips chaos capsule turns black hole rick grabs lockerean preventing sucked however sees jerry ’s mother getting foot caught sucked toward black hole jerry ’s pants also get sucked getting sucked straight towards rick lets go lockerean grab blank fortune use cybernetic implant print "" jerry sex mom "" last second swoops launches fortune jerry ’s mouth causing black hole disappear genitals make contact.when rick jerry arrive home jerry gives rick last real fortune cookie handwritten note says "" thank "" rick makes lightly chastises wasting appreciates sentiment jerry thanks rick refers friend greatly angers rick earlier eaten fortune cookie fortune saying "" make new friend "" batch mass produce cookies referring rick friend jerry accidentally destroyed rick ’s immortality jerry tries play friendship fate still control causes rick slap face causing cry rick apologizes jerry forgives two head inside.in post credits scene morty summer beth space beth zoo ’s gift shop morty watching ad zoo targeted zebras humans zoo started eating zebra food leaving zebras starve fighting killing morty starts confused purpose ad zebra food gift shop deducing ones zoo human zoo"
56,JuRicksic Mort,"morty late school asks rick help arrive time rick tries using portal gun working fixing however portal gun still somewhat unusable summon cthulhu -like beast rick drives decides simply drive morty school way morty brings portal gun rick tells every time someone brings portal gun demotivates fix "" process"".when morty arrives school mysterious giant spaceships land everywhere earth spaceships contain dinosaurs shocked find dinosaurs went extinct earth evolved monkeys rule planet dinosaurs left earth world utopia technology used good living creatures technology advanced decided travel distant corners galaxy helping planets achieve level peace however upon return see humanity use technology building utopia decide take matters hands un meeting three leaders dinosaurs — tyrannosaurus brachiosaurus triceratops — convince planet ’s leaders take vacation enjoy life change world better dinosaurs end world hunger remove necessity jobs solve humanity ’s problems.everyone free enjoy lives morty summer beth eventually get bored nothing anymore jerry finally manages publish book titled "" never trying never fails "" president phone calls rick meets restaurant called "" bar beau q "" president tired nothing day asks rick get rid dinosaurs however dinosaurs ’ presence affect rick since used living responsibility free president makes deal rick : gets rid dinosaurs rick host 95th annual academy awards rick accepts.rick morty meet dinosaurs ’ three leaders rick introduces powerful human alive tells dinosaurs willing share secrets interdimensional travel spread culture across universes dinosaurs respond saying discovered interdimensional travel years ago strict "" one universe "" policy also tell rick portal travel method sub optimal give improved portal pistol even volunteer close interdimensional rift evil morty left behind sending rick morty back house rick gets enraged destroys portal pistol decides travel planets dinosaurs previously travelled to.while going morty planets rick finds every planet used contain dinosaurs wiped giant meteors planet different species explanations craters dinosaur fossils — dinosaurs using craters amphitheaters using skate parks turns evolution dinosaurs morally perfect creatures led universe seek balance devolving creatures wreak havoc across galaxy creatures sentient meteors seek nemesis : dinosaurs.back earth dinosaurs turn jerry ’s book manual humanity survive lack problems unfortunately jerry get credit dinosaurs believe manual ’s author simply wants spread word expecting credit rick morty arrive back earth rick reveals screaming meteor headed causing entire human population revolt dinosaurs.after spending time devising solution meteor problem require violence dinosaurs decide leave earth good planet reverts back old state war crime hunger pollution destruction natural resources people content though many troubles distract emptiness existence rick celebrates victory 95th annual academy awards still learns backstage dinosaurs mars ready sacrifice meteors leaves hurry.rick travels mars claims wait killer meteor dinosaurs risking life pettiness meteor rapidly approaching dinosaurs attempt teleport rick away dino proofed dinosaurs distressed thought meteor killing human eventually one dinosaurs resorts destroying rock get rick back dinosaurs close rift central finite curve rick yells despair rift could used milked whole season "" like three episode arc least "" making subtle reference gravity falls ’ event weirdmageddon ultimately channels energy fixing portal gun jerry tries write second book.in post credits scene dinosaurs another unknown planet actually use crater skate park"
57,Full Meta Jackrick,episode starts recap sequence rick suspects something wrong soon rick morty confronted previous leon creature injects venom prey also recap sequence rick morty counteract leon ’s toxins fly opening title sequence morty asking going escpaing leon grabbed rick tells morty listen meta leon tries kill morty gun rick tackles flying away shot rick wounding leon escapes meta layer fourth wall knowing danger letting leon escape rick takes morty meta layer meta reality.they manage get leon leon summons jesus christ turn summons story lord managed escape story train story lord reveals grown weary someone duo previously fought plans obtain motivation order fictional character jesus battles rick morty story lord openly betrays jesus much latter ’s disbelief ambushed previous leon traps recap venom rick knocks leon intending take self referential six two leon arrive groups ’ fortress clash members ; miss lead ( establishes expectations subverts ) flash back ( enters observes past events ) connie tinuityerror ( warps reality making inconsistent past ) protago nick ( makes character protagonist ) mr twist ( creates plot twists ) mr twist manages capture rick morty morty frees releasing pins mr twist ’s smash cut grenades heading dungeons rick intends free rhett caan powerful character ability warp reality words broking deal rhett caan rick frees cell self referential six arrive immediately regrets decision rhett caan kills connie coffee paralyzes mr twist removing bones rick morty start run rhett caan places fortress void turns fortress orange.meanwhile story lord teleports citadel toyz llc company makes story trains confronts creator jan reveals character flawed beginning company use used irritated story lord take jan order get motivation.back meta reality rick morty stuck frozen wasteland narrative less void thanks rhett caan saved joseph campbell also saved previous leon.in post credit scene tag man another meta reality character possible member self referential six fights arena easily destroys opponents noting misses wife
