,title,text
19,Look Who's Purging Now,"flying space rick morty collide interstellar insect smears windshield ; rick attempts clean windshield becomes even smeared rick decides search washer fluid nearby planet upon arriving rick discovers citizens planet sustain peaceful way life engaging open warfare one night every year ; upon discovering aforementioned night ( citizens call "" festival "" ) evening rick pleasantly proposes morty stay observe murderous rite.they succeed finding wiper fluid depart sun sets flying low surface planet festival begins rick ’s enthusiasm festival quickly crushed particularly gruesome death sprays copious amounts blood onto windshield vomits window thoroughly disgusted sight morty sees girl trouble demands rick save ; rick objects morty blackmails complying upon landing ( top one girl ’s attackers ) rick enthusiastically begins shooting everybody comes near morty suggests girl arthricia wait festival ship rick sarcastically agrees.at smith house jerry summer get argument jerry ’s pointless conversation jerry leaves room heckled summer.arthricia asks morty stop asking questions festival leading awkward silence girl suddenly screams forgotten grandmother ; group travels ramshackle farmhouse despite misgivings rick follows arthricia inside double crosses : overpowers rick steals gun shoots finally coercing morty surrender ship apologizing flies away night struggling controls moving inside cabin fire morty finds rick wounded floor helps shack group people advance ; rick disintegrates one however surrender give weapons.summer jerry begin renew argument "" space phone "" rick gave rings summer retrieves somewhat forgotten place sofa cushions hiding shack morty process creating chemical solution heal wound rick gives details situation dispatching people bursting cabin jerry asking person phone taddy mason dictates number summer killing last intruder spoon ( thing morty threw rick asked help ) berating morty throwing "" one thing never kill anything "" rick tells summer find red box workbench take outside enter aforementioned number box.to set beacon rick identifies "" package "" rick morty head toward lighthouse intending assemble beacon observation platform however owner lighthouse consents condition one listens story rick heads top lighthouse morty agrees listen story discovers movie script absolutely atrocious pass time decides eat one two candy bars given person gave wiper fluid.summer jerry go garage summer retrieves red box places floor berating jerry insistence resolving issue inputs numbers box upon completion sequence box pops open forming launchpad large silvery orb smaller red dot side jerry continues trying restore dignity orb hurls ceiling sky leading summer muse "" oh might said take outside ""on observation deck rick finishes assembling receiver main room owner finishes reading morty whose patience wearing thin repeatedly asking morty honest opinion morty says problem way story begins flash back teaser owner suddenly offended responds ordering leave morty becomes confused owner claims shared something personal "" took giant shit "" morty becomes offended attacks character tells owner asked set beacon owner tells morty longer morty "" shitty person insecure "" mounts stairs upon reaching top tells rick leave claiming morty "" shitty person "" morty quickly defends claiming "" sat "" entire screen play infuriating owner fed owners insecurities morty reveals hated entire story rick reminds morty guests morty retorts tried behave owner dragged anger owner tries shut receiver morty stops claiming bad person owner insecure writing pushes flight stairs fit rage killing leaving rick astonished.jerry tries reconnect summer recalling memories past conversation devolves plea money jerry summer leaves garage piece shattered roof falls head utters "" guess rock bottom feels like"" .. leaving lighthouse horde rioters confronts including man gave wiper fluid candy bars fight break however orb like probe lands rick morty assembles suits weaponized flying armor onto bodies rick immediately begins slaughter mob first morty hesitant soon finds "" inner rage "" slaughters entire mob ( suit plays "" feels good "" tony toni toné ) rick congratulates morty finding ability purge looking ship rick succeeds finding crashed side building turns around find morty slaughtering every person sight even hiding ; even every one killed morty continues firing round round long dead bodies even rick gently ushers back toward ship.reaching ship find arthricia crawling ground nearby train weapons explains true intentions : use ship murder arrogant rich people force peasants fight death morty drunk rage insists killing arthricia spot rick tells morty calm morty threatens kill rick point rick tasers morty get control asks arthricia rich people are.at mansion outside town planet ’s wealthy make dinner toast another successful year festival going thousands years moments later sound "" feels good "" floats air arthricia wearing morty ’s power suit rick morty tied back break door rick tells rich people nothing arthricia deeply offended forcing peasants kill suffering consequence explains arthricia ’s suit power armor way fairly apportioning power among arthricia begins exact revenge slaughtering rich people inviting rick join bloodbath rick initially refuses saying killing become "" gratuitous "" eventually joins asked second time killing rich people rick arthricia ecstatically dance "" feels good"".as sun rises morning morty finally wakes ship encouraged rick morty goes talk arthricia spurns saying boyfriend.as rick morty preparing leave townsfolk discuss building new society ground rick suggests using food barter rick morty leave discussion food escalates bloody brawl one townsfolk stops brawl explains plan stopping violence stabilizes basic concept festival within society.on way back earth morty reflects rage fueled rampage shame rick assures none actions fault cause violent rage due eating candy bar contained purgenol chemical amplifies person ’s violent tendencies rick convinces morty despite happened previous night nothing changed rick throws candy bar back seat candy bar ’s wrapper faces revealing sticker reads "" purgenol free"".in post credits scene beth asks jerry phone bill $ 700 inquires "" taddy mason l.l.c "" stands soon taddy mason commercial plays television explains dial friend pay service callback option beth soaks information jerry tries desperation shut television finally unplugs t.v beth bluntly tells jerry "" get job """
20,The Wedding Squanchers,"  rick morty beth summer jerry eating breakfast beth telling jerry get job knock door "" courier flap "" arrives organism servicing intergalactic mail service birdperson ’s invitation wedding tammy planet squanch rick immediately declines saying weddings always make people miserable ( words "" funerals cake "" ) beth attempts convince rick attend friend ’s special event jerry manages accidentally transported via courier planet forcing reluctant rick bring rest family wedding.the family arrives squanchy greeting smith family ( minus rick ) mingle numerous guests ; jerry unsuccessfully tries joke tammy ’s parents beth inquires rick birdperson discloses vague dark parts rick ’s past morty protests rick opening enjoying wedding.tammy reveals galactic federation agent.birdperson tammy rick reluctantly follows morty ’s advice open giving ad libbed wedding toast love happiness newly married couple unfortunately happiness ends bride reveals deep undercover galactic federation agent building surrounded officers reception erupts chaos birdperson shot multiple times seemingly killed much rick ’s horror majority criminals attending wedding gunned rick use portal gun tammy ambushes holds gunpoint ordering give gun although also wires kill several galactic federation officers explode able recovered consequently explosion also renders tammy temporarily deaf final shots fired still living squanchy provides diversion family escape drinking potion turning large warrior temporarily fighting surviving galactic federation goons avenging many allies ’ deaths.following chaos wedding angered rick reveals vehemently federation enough join forces late birdperson like minded rebels despite beth ’s suggestion return home rick points option longer possible earth first place federation look even goes far say go home could interrogated despite knowing rick might escape to.instead suggests finding new world live upon asking computer finds 765 planets similar earth milky way 3 existing outside federal jurisdiction find similar earth like planet also find incredibly small find much larger planet everything plants even animal life "" cob "" however rick panics discovery quickly takes everyone back last federation free planet seems almost perfect ( "" cob free "" ) discover sun screams endlessly throughout planet ’s 42 hour day small earth options decide return small earth.while hiding small earth smiths learn news broadcast federation occupied earth attempt find ultimately rick rick explores cave leading house overhears rest family arguing predicament jerry suggests turning rick main reason caring one everyone else especially beth willing put rick ’s antics sacrifice current future lives earth lose summer arguing love someone hopes reward morty reiterating birdperson ’s response seeking abandon rick armageddon refuting jerry convicting family stick beside rick even would upon hearing family defend beth eventually break emotionally confess scared abandoned rick realizes despite treating family badly past willing sacrifice lives futures earth causes guiltily reflect fact selfish destructive person eventually leading defining moment decides turn galactic federation saying goodbye morty guise ice cream run flies nearby cantina await arrest en route cantina rick poses jerry tip galactic federation rick found asking family spared turns smiths wanted federation.the smiths escorted back earth galactic federation protectorate jerry happy robotic agent tells report employment office "" assigned function "" order pay debt 7,000 credits antidepressant pills although morty rest family seem ill ease.rick booked incarcerated maximum security federation prison seemingly without bail parole fellow prisoner asks "" everything "" rick glumly replies.in post credits scene mr poopybutthole seen apartment watching show breaking 4th wall turns set limps table chipperly addressing viewers swallows inordinate amount painkillers noting treat lingering pain beth shot total rickall pesters pizza delivery guy door show favorite part delivery man idea talking mr poopybutthole tells viewers tune season three see "" mess "" rick unravels"
21,The Rickshank Rickdemption,"episode starts rick family sitting booth old fashioned american diner shoney ’s talking rick ’s escape space prison rick smells rat orders jerry fold 12 times "" jerry "" manages contort six folds revealing fact simulation based rick ’s memories.mature rick.a galactic federation agent named cornvelious daniel sitting next booth introduces reveals sent gather information rick ’s mind via brain link agent makes clear rick ’s brain liquefied end session might well revisit memories one last time.summer finds portal gun.meanwhile morty family back earth run galactic federation jerry works   unspecified occupation beth lost job due federation ’s advanced medical knowledge unhappy current way life summer decides save rick digs portal gun buried rick backyard next alternate dimension corpse morty tries dissuade summer family ’s robot butler conroy turns hostile attempts confiscate portal gun morty transports   "" cronenberg world ""   family rick c-137 abandoned previously.morty ’s original family replacement summer background.after arrive conroy destroyed jerry smith summer smith abandoned prime dimension morty summer join along beth smith feast roasted cronenberg cataclysm endured dimension affords morty proof summer rick care anyone especially family point jerry smashes portal gun preventing summer morty leaving.a sham trial.agents council ricks show investigate compromised portal gun immobilizing jerry beth summer freeze ray summer informs agents rick c-137 captured agents dispatch rick council seal team assassinate rick c-137 summer morty captured subsequent kangaroo court aboard citadel ricks summer morty speak council rick c-137 ’s defense morty reveals never gave rick trying protect sister dangers life rick involved.beth diane.back brain link simulation rick stops mcdonalds drive thru orders chicken mcnuggets szechuan sauce rick shows agent memory lost wife beth explosion first dimension driving invent first portal gun agent collects believes genuine portal gun formula uploads brain link server agent attempts leave brain link communication device fails rick reveals "" code "" given actually virus giving control entire system "" memory "" visited "" fabricated "" origin story rick transfers consciousness brain link physical body agent.at point rick council seal team shows kills aliens rick d-99 seal team member shoots rick c-137 ’s old body head destroying rick manages transfer consciousness agent body rick d-99 quickly afterward another seal team rick shoots agent body killing rick d-99 rick c-137 ( new body ) kills rest agents interrogates surviving rick surviving rick tells morty summer citadel rick thanks last surviving rick shoots head.rick transports citadel galactic federation prison.rick rappels rope leaves galactic federation prison makes way teleportation control room citadel ricks switching consciousness high ranking rick teleports entire citadel back middle federation prison resulting heated battle two sides rick c-137 infiltrates council chamber kills council ricks ending standoff final member attempting use summer hostage.with clever bit trickery rick morty combine efforts save summer escape back earth rick returns prison ’s control room changes galactic federation ’s currency blemflarcks 1 blemflarck worth 0 blemflarcks economy shambles federation follows suit sending whole galaxy chaos resulting many aliens leaving earth.rick jerry.by time rick morty summer return home jerry unemployed beth simply relieved family home safe sound unhappy father law ’s return jerry demands beth chooses rick leading two deciding divorce.all wants szechuan chicken mcnugget sauce.once beth summer leave garage rick reveals morty captured purpose order take revenge galactic federation jerry crossing eliminating jerry rick takes role undisputed patriarch family morty forced continue adventures beth summer view rick hero rick explains wants plans get szechuan chicken mcnugget sauce discontinued mcdonalds years ago understandably morty visibly horrified revelation garage door closes rick continues rant szechuan sauce.in post credits scene birdperson ’s   corpse reanimated cybernetic parts renamed "" phoenixperson "" tammy criticizes creative enough tammy fly distance presumably take revenge rick.guest starringstarringfly code.mabel dipper mortys.view full transcript episode .click view page ’s gallery"
22,Rickmancing the Stone,"jerry wearing rick morty summer fall portal back garage another adventure jerry shows garage door say goodbye children though morty tries talking father summer ignores asks rick take somewhere else morty reluctantly joining beth comes garage looking morty summer promptly leaves seeing jerry jerry pathetically stands outside house wind quietly calls loser.the leader begs summer kill coldly agrees.rick ’s portal takes grandchildren diesel fueled post apocalyptic earth filled dieselpunk cars shotguns mutants cannibals rick ’s main goal retrieve powerful isotope-322 adventure sidetracked summer becoming enamored dimension killing leader death stalkers forming alliance though rick morty initially want go home rick sees death stalkers large rock form isotope-322 decides stick around steal it.morty handling parents ’ divorce well.while summer goes kill people rick tries get morty make distraction ringer thunderdome ( blood dome death stalkers call ) rick inserts serum extracts muscle memory body parts morty ’s arm give combat skills "" muscle memory "" apparently includes memories personality said body parts giving morty left arm enormous strength punches rick beating killing various death stalkers blood dome though morty initially soon begins venting frustrations jerry agreeing divorce arm rick tries get morty summer leave death stalkers notice someone stole isotope-322 morty ’s arm reveals theft forcing rick pull laser gun telling viewer right back.summer morty chase rick.the episode continues rick chased grandchildren separate cars tries convince merely staying world want confront parents ’ divorce ultimately gives portals back garage leaving morty summer trapped ( albeit willingly ) death stalkers.summer hemorrhage hook up.while blood dome morty ’s arm recognizes soldier killed wife children torturing proceeds chase away blood dome kills arm wanting revenge soldier ’s boss morty forced come along meanwhile summer strikes romantic relationship new leader death stalkers guy bucket head named hemorrhage .wanting hide absence beth rick builds morty summer robots fool cheer beth succeed making cry leaving call jerry.armothy ’s unfinished business.morty arm dubbed "" armothy "" prepare take revenge soldier ’s boss morty tries convince armothy hold revenge continue vent frustrations toward divorce soon realizes like armothy needs learn move starts choke man death rick arrives retrieve admitting would much trouble find different morty summer cheer beth helps morty finish armothy ’s murder victim.well looks familiar.rick morty meet summer hemorrhage offering isotope-322 powers peace offering hemorrhage asks help restoring society rick agrees supposedly way avoid dealing daughter ’s divorce three weeks later post apocalypse turned something resembling modern day suburbia summer stuck unfulfilling marriage hemorrhage-- one resembling jerry beth’s.summer ’s ready leave.frustrated summer agrees return earth rick morty realizing rick planned whole thing teach running problems home leave rick steals last isotope-322 ultimately sending post apocalypse world back started trio interfered.he wants run stream.the trio return house rick ’s robot morty made distract beth gains sentience trying fight programming stay alive programming overridden robots destroyed originals.morty remarks mother jerry really wanted stay would fought make happen : ultimately either care strong enough summer visits jerry gives skull first mutant killed creature made mistake looking back escaping reminder look back ""looooser ""in post credit scene jerry tries retrieve unemployment check mail confronted wolf threatens chews check apparently make suffer wind calls loser again.non speaking charactersunknown voicesguest starringstarringview full transcript episode .click view page ’s gallery"
23,Pickle Rick,"guess needing morty preparing school advised therapy session bathroom hears rick ’s voice follows voice garage find rick turned pickle "" could "" beth summer appear notice rick ’s pickle status well morty suspects rick avoid going therapy session noticing dangling syringe rigged inject rick moment others leave rick denies idea getting going claims syringe irrelevant response beth removes syringe puts purse leaves children.now alone table rick starts making random sounds cat named izzy appears rick tells cat back stating seen youtube videos cats attacking pickles cats afraid snakes think pickles snakes cat knocks rick pushing outside garage exposing rick sun rick grudgingly states dying pickle form heat mega genius equivalent dying toilet fortunately timely rain shower saves fate.rick falls sewers.however resulting rush water flushes rick sewer drain forcing survive sewers rick creates bit pickle juice lures cockroach towards cockroach killed rick bite head removes part cockroach ’s head rick uses brain cockroach propel forward.at counseling office learn therapy session advised school summer huffing pottery enamel morty wetting pants class believed signs protesting parents ’ divorce mr goldenfold runs way : eating poop asks others beth summer morty greeted dr wong therapist therapy session begins beth talks rick could attend genius morty blurts rick turned pickle dr wong uses idea start discussion rick turned pickle ""oh yeah "" rick ’s disgusting suit rats parts.rick seen cutting sewer grate using makeshift exo suit decapitated roaches pondering next move ( sewer line ) sewer rat appears tries attack rick rick uses elaborate trap decapitate unwary rodent rick taunts rats arrived puts dead rat ’s head top another contraption creating rat version exo suit sewer bars break open rats pouring rick begins kill every rat sight various small items including screws box cutters ""mom "" beth continues denial uncooperative.inside counseling office beth talks rick important summer replies back says rick lied turned pickle avoid counseling session beth yells rick dr wong notices use science common form communication family discusses dr wong asks could inside syringe replying liquid change rick back human beth disagrees gets angry flips delivers f bombs dr wong siblings.rick lands hero pose.rick killed largest toughest rat enters sewer pipe using rockets lands toilet exultantly yells "" pickle riiick "" leaves men ’s bathroom begins search exit stumbles upon elevator moves nearby objects allow parkour towards elevator door button.a pickle shames recycling.rick approached agents speak russian begin shooting rick rick runs room starts building weapons office supplies rick taunts agency director building killing agents using traps bombs laser gun agency director uses last resort method calls upon captured fighter named jaguar kill rick.back therapy dr wong asks syringe beth replying dr wong say siblings say anti pickle serum dr wong talks serum beth cutting beth talks session supposed siblings angry divorced jerry morty starts notice interesting features therapy room particularly book displaying people eating feces dr wong says going take sides states beth admires rick beth blatantly says better making peoples ’ problems dr wong questions reason looks ""ow "" rick staples pickle slice treat wound.rick jaguar begin fighting leading becoming wounded treating injuries leading talking motives rick proceeds destroy cameras fighting jaguar agency director receives call rick saying "" jaguar could make "" rick remarking ’ll hunt agency director agency director offers 100 million dollars bonds rick demands given jaguar ’s daughter set free agency director says dead rick refuses reason agency director kills two remaining guards flees roof get helicopter.the director looks defeated.the helicopter flies away jaguar steering rick using cigarette creates explosion kills agency director jaguar rick talk families jaguar ends leaving jaguar seen comic style flash ending.the family seen using simple sentences describe currently want : summer morty admit summer ’s sniffing enamel morty ’s desk wetting nothing divorce : one getting high mere accident.the wonderful dr wong lays facts.rick appears badly injured joins asking beth serum indeed turn back human rick says turned pickle respect therapy therefore want go claiming therapy boring people need dr wong agrees going therapy rather taking time repair relationships family boring boring way brushing teeth performing bathroom hygiene adventure : way way die putting work perhaps people would rather die put work rick retort session ends.summer morty ignored truly terrible parents.on ride home rick apologizes beth lying beth responds injecting syringe finally turning back human rick beth plan go get drink dropping siblings ignoring summer morty asking ’ll ever go back therapy.in post credits scene rick morty tied giant piano killed concerto rick says sorry getting morty situation believes definitely die unpredictably jaguar appears kills concerto leaves morty asks rick replies "" morty go therapy "" concerto clear reference liberace giant candelabra placed piano characteristic attribute performances.non speaking charactersstarringview full transcript episode .click view page ’s gallery"
